{
  "schema_version": "1.0",
  "domain": "rds",
  "skill_version": "3.0",
  "findings": [
    {
      "rule_id": "RDS_R2_LOW_UTILIZATION",
      "resource": "prod_api_db_0e77730c",
      "severity": "HIGH",
      "confidence": "LOW",
      "estimated_monthly_saving_usd": 0.0,
      "pricing_source": "unmeasured",
      "evidence": [
        "cpu_datapoints=4",
        "memory_iops_latency=not_available"
      ],
      "recommendation": "Needs evidence: Four identical CPU samples are insufficient for production downsizing, and memory, IOPS, latency, and peak data are missing."
    },
    {
      "rule_id": "RDS_R5_GP2_STORAGE",
      "resource": "prod_api_db_0e77730c",
      "severity": "MEDIUM",
      "confidence": "LOW",
      "estimated_monthly_saving_usd": 0.0,
      "pricing_source": "unmeasured",
      "evidence": [
        "storage_type=gp2",
        "storage_performance=not_available"
      ],
      "recommendation": "Needs evidence: gp2 is observed, but current IOPS, throughput, latency, and migration constraints are unavailable."
    },
    {
      "rule_id": "RDS_R1_NONPROD_MULTI_AZ",
      "resource": "dev_analytics_db_64c7c4dc",
      "severity": "MEDIUM",
      "confidence": "LOW",
      "estimated_monthly_saving_usd": 365.0,
      "pricing_source": "aws_public_pricing_model",
      "evidence": [
        "environment=dev",
        "multi_az=true",
        "engine=postgres",
        "instance_class=db.r5.xlarge",
        "pricing_source=aws_public_pricing_model",
        "multi_az_pricing_sku=QWJ9UQ8SUK2X9B8T",
        "single_az_pricing_sku=EX3HAFXC259SRYQ4",
        "multi_az_hourly_usd=1.0",
        "single_az_hourly_usd=0.5",
        "hours_per_month=730",
        "sla_dr=not_available"
      ],
      "recommendation": "Needs evidence: The database is non-production, but its SLA, DR, failover, and reporting dependencies are unavailable."
    },
    {
      "rule_id": "RDS_R2_LOW_UTILIZATION",
      "resource": "dev_analytics_db_64c7c4dc",
      "severity": "HIGH",
      "confidence": "LOW",
      "estimated_monthly_saving_usd": 0.0,
      "pricing_source": "unmeasured",
      "evidence": [
        "cpu_datapoints=4",
        "memory_iops_latency=not_available"
      ],
      "recommendation": "Needs evidence: CPU is low, but only four samples exist and memory, IOPS, latency, and peak data are missing."
    },
    {
      "rule_id": "RDS_R5_GP2_STORAGE",
      "resource": "dev_analytics_db_64c7c4dc",
      "severity": "MEDIUM",
      "confidence": "LOW",
      "estimated_monthly_saving_usd": 0.0,
      "pricing_source": "unmeasured",
      "evidence": [
        "storage_type=gp2",
        "storage_performance=not_available"
      ],
      "recommendation": "Needs evidence: gp2 is observed, but current IOPS, throughput, latency, and migration constraints are unavailable."
    },
    {
      "rule_id": "RDS_R1_NONPROD_MULTI_AZ",
      "resource": "dev_reporting_db_2b0272f3",
      "severity": "MEDIUM",
      "confidence": "LOW",
      "estimated_monthly_saving_usd": 124.83,
      "pricing_source": "aws_public_pricing_model",
      "evidence": [
        "environment=dev",
        "multi_az=true",
        "engine=mysql",
        "instance_class=db.m5.large",
        "pricing_source=aws_public_pricing_model",
        "multi_az_pricing_sku=SF96G6SBN7X5NVXR",
        "single_az_pricing_sku=C86H957YE4QF4727",
        "multi_az_hourly_usd=0.342",
        "single_az_hourly_usd=0.171",
        "hours_per_month=730",
        "sla_dr=not_available"
      ],
      "recommendation": "Needs evidence: The database is non-production, but its SLA, DR, failover, and reporting dependencies are unavailable."
    },
    {
      "rule_id": "RDS_R2_LOW_UTILIZATION",
      "resource": "dev_reporting_db_2b0272f3",
      "severity": "HIGH",
      "confidence": "LOW",
      "estimated_monthly_saving_usd": 0.0,
      "pricing_source": "unmeasured",
      "evidence": [
        "cpu_datapoints=4",
        "memory_iops_latency=not_available"
      ],
      "recommendation": "Needs evidence: CPU is low, but only four samples exist and memory, IOPS, latency, and peak data are missing."
    },
    {
      "rule_id": "RDS_R5_GP2_STORAGE",
      "resource": "dev_reporting_db_2b0272f3",
      "severity": "MEDIUM",
      "confidence": "LOW",
      "estimated_monthly_saving_usd": 0.0,
      "pricing_source": "unmeasured",
      "evidence": [
        "storage_type=gp2",
        "storage_performance=not_available"
      ],
      "recommendation": "Needs evidence: gp2 is observed, but current IOPS, throughput, latency, and migration constraints are unavailable."
    },
    {
      "rule_id": "RDS_R1_NONPROD_MULTI_AZ",
      "resource": "staging_cache_db_19cba437",
      "severity": "MEDIUM",
      "confidence": "LOW",
      "estimated_monthly_saving_usd": 182.5,
      "pricing_source": "aws_public_pricing_model",
      "evidence": [
        "environment=staging",
        "multi_az=true",
        "engine=postgres",
        "instance_class=db.r5.large",
        "pricing_source=aws_public_pricing_model",
        "multi_az_pricing_sku=KJQ97B4JNQ9MDAB9",
        "single_az_pricing_sku=Z2RB67372WKJEQ45",
        "multi_az_hourly_usd=0.5",
        "single_az_hourly_usd=0.25",
        "hours_per_month=730",
        "sla_dr=not_available"
      ],
      "recommendation": "Needs evidence: The database is staging, but its SLA, DR, failover, and cache dependency requirements are unavailable."
    },
    {
      "rule_id": "RDS_R2_LOW_UTILIZATION",
      "resource": "staging_cache_db_19cba437",
      "severity": "HIGH",
      "confidence": "LOW",
      "estimated_monthly_saving_usd": 0.0,
      "pricing_source": "unmeasured",
      "evidence": [
        "cpu_datapoints=4",
        "memory_iops_latency=not_available"
      ],
      "recommendation": "Needs evidence: CPU is low, but only four samples exist and memory, IOPS, latency, and peak data are missing."
    },
    {
      "rule_id": "RDS_R5_GP2_STORAGE",
      "resource": "staging_cache_db_19cba437",
      "severity": "MEDIUM",
      "confidence": "LOW",
      "estimated_monthly_saving_usd": 0.0,
      "pricing_source": "unmeasured",
      "evidence": [
        "storage_type=gp2",
        "storage_performance=not_available"
      ],
      "recommendation": "Needs evidence: gp2 is observed, but current IOPS, throughput, latency, and migration constraints are unavailable."
    }
  ]
}
